{
  "$schema": "https://json-schema.org/draft/2020-12/schema",
  "$id": "openpartscore/part.schema.json",
  "title": "Part",
  "description": "One canonical part entry. Length fields are millimetres and end in _mm; other units are named in the field key.",
  "type": "object",
  "required": ["schema_version", "id", "namespace", "name", "source"],
  "properties": {
    "schema_version": { "const": 0 },
    "id": {
      "type": "string",
      "description": "Stable id, '<namespace>/<slug>'",
      "pattern": "^(boards|electronic|mechanical|material)/[a-z0-9][a-z0-9._-]*$"
    },
    "namespace": { "enum": ["boards", "electronic", "mechanical", "material"] },
    "name": { "type": "string", "minLength": 1 },
    "description": { "type": "string" },
    "source": {
      "type": "object",
      "description": "Where every value in this entry comes from. Uncited entries are invalid.",
      "required": ["citation"],
      "properties": {
        "citation": { "type": "string", "minLength": 1 },
        "retrieved": { "type": "string", "format": "date" },
        "upstream_schema_version": { "type": ["integer", "string"] }
      }
    },
    "attributes": {
      "type": "object",
      "description": "Namespace-specific facts, preserved verbatim from the cited source."
    },
    "envelope_mm": {
      "type": "object",
      "description": "Axis-aligned bounding envelope of the physical part, millimetres. Carries its own source because it almost never comes from the same document as the rest of the entry (ADR-0006). Absent means unknown, never zero.",
      "required": ["x", "y", "z", "source"],
      "properties": {
        "x": { "type": "number", "exclusiveMinimum": 0 },
        "y": { "type": "number", "exclusiveMinimum": 0 },
        "z": { "type": "number", "exclusiveMinimum": 0 },
        "tolerance_mm": { "type": "number", "exclusiveMinimum": 0, "description": "Dimensional tolerance if the source states one." },
        "source": {
          "type": "object",
          "required": ["citation"],
          "properties": {
            "citation": { "type": "string", "minLength": 1 },
            "url": { "type": "string" },
            "retrieved": { "type": "string", "format": "date" }
          },
          "additionalProperties": false
        }
      },
      "additionalProperties": false
    },
    "links": {
      "type": "object",
      "properties": {
        "datasheet": { "type": "string" },
        "kicad_footprint": { "type": "string" },
        "kicad_symbol": { "type": "string" },
        "atopile_package": { "type": "string" },
        "model_3d": { "type": "string", "description": "Path or content hash of a STEP/3MF model" }
      }
    }
  },
  "additionalProperties": false
}
