{
  "schema_version": 0,
  "id": "boards/esp32-c5",
  "namespace": "boards",
  "name": "esp32-c5",
  "description": "ESP32-C5 RISC-V single-core @ 240 MHz (dual-band 2.4/5 GHz Wi-Fi 6, BLE 5, 802.15.4; native USB; shared VID/PID)",
  "source": {
    "citation": "Oh-Ben-Claw registry/registry.json (generated from src/peripherals/registry.rs)",
    "retrieved": "2026-08-15",
    "upstream_schema_version": 1
  },
  "attributes": {
    "usb_ids": [
      {
        "vid": 12346,
        "pid": 4097,
        "architecture": "ESP32-C5 RISC-V single-core @ 240 MHz (dual-band 2.4/5 GHz Wi-Fi 6, BLE 5, 802.15.4; native USB; shared VID/PID)"
      }
    ],
    "capabilities": [
      "analog_read",
      "ble",
      "gpio",
      "i2c",
      "spi",
      "thread",
      "wifi",
      "zigbee"
    ],
    "connectors": [
      "bare"
    ],
    "vendor": "Espressif",
    "ecosystem": "ESP32-C5",
    "transport": "serial"
  },
  "links": {}
}
