{
  "schema_version": 0,
  "id": "boards/cp2102",
  "namespace": "boards",
  "name": "cp2102",
  "description": "Silicon Labs CP2102 USB-UART bridge",
  "source": {
    "citation": "Oh-Ben-Claw registry/registry.json (generated from src/peripherals/registry.rs)",
    "retrieved": "2026-08-15",
    "upstream_schema_version": 1
  },
  "attributes": {
    "usb_ids": [
      {
        "vid": 4292,
        "pid": 60000,
        "architecture": "Silicon Labs CP2102 USB-UART bridge"
      }
    ],
    "capabilities": [],
    "connectors": [
      "bare"
    ],
    "vendor": "Silicon Labs",
    "ecosystem": "USB-UART",
    "transport": "serial"
  },
  "links": {}
}
