{
  "schema_version": 0,
  "id": "boards/ftdi-ft231x",
  "namespace": "boards",
  "name": "ftdi-ft231x",
  "description": "FTDI FT231X USB-UART bridge",
  "source": {
    "citation": "Oh-Ben-Claw registry/registry.json (generated from src/peripherals/registry.rs)",
    "retrieved": "2026-08-15",
    "upstream_schema_version": 1
  },
  "attributes": {
    "usb_ids": [
      {
        "vid": 1027,
        "pid": 24597,
        "architecture": "FTDI FT231X USB-UART bridge"
      }
    ],
    "capabilities": [],
    "connectors": [
      "bare"
    ],
    "vendor": "FTDI",
    "ecosystem": "USB-UART",
    "transport": "serial"
  },
  "links": {}
}
