{
  "schema_version": 0,
  "id": "boards/esp32-s3-cam",
  "namespace": "boards",
  "name": "esp32-s3-cam",
  "description": "ESP32-S3 + OV2640/OV5640 camera, microSD, PSRAM (native USB; shared VID/PID)",
  "source": {
    "citation": "Oh-Ben-Claw registry/registry.json (generated from src/peripherals/registry.rs)",
    "retrieved": "2026-08-15",
    "upstream_schema_version": 1
  },
  "attributes": {
    "usb_ids": [
      {
        "vid": 12346,
        "pid": 4097,
        "architecture": "ESP32-S3 + OV2640/OV5640 camera, microSD, PSRAM (native USB; shared VID/PID)"
      }
    ],
    "capabilities": [
      "ble",
      "camera_capture",
      "gpio",
      "i2c",
      "microsd",
      "psram",
      "wifi"
    ],
    "connectors": [
      "bare"
    ],
    "vendor": "Espressif",
    "ecosystem": "ESP32-S3",
    "transport": "serial"
  },
  "links": {}
}
