{
  "schema_version": 0,
  "id": "boards/arduino-nano-33-ble",
  "namespace": "boards",
  "name": "arduino-nano-33-ble",
  "description": "nRF52840 ARM Cortex-M4F @ 64 MHz (BLE, IMU)",
  "source": {
    "citation": "Oh-Ben-Claw registry/registry.json (generated from src/peripherals/registry.rs)",
    "retrieved": "2026-08-15",
    "upstream_schema_version": 1
  },
  "attributes": {
    "usb_ids": [
      {
        "vid": 9025,
        "pid": 32858,
        "architecture": "nRF52840 ARM Cortex-M4F @ 64 MHz (BLE, IMU)"
      }
    ],
    "capabilities": [
      "analog_read",
      "ble",
      "gpio",
      "i2c",
      "sensor_read",
      "spi"
    ],
    "connectors": [
      "bare"
    ],
    "vendor": "Arduino",
    "ecosystem": "Nano",
    "transport": "serial"
  },
  "links": {}
}
