{
  "schema_version": 0,
  "id": "boards/nanopi-neo3",
  "namespace": "boards",
  "name": "nanopi-neo3",
  "description": "Rockchip RK3328 quad-core ARM Cortex-A53 @ 1.5 GHz (AArch64)",
  "source": {
    "citation": "Oh-Ben-Claw registry/registry.json (generated from src/peripherals/registry.rs)",
    "retrieved": "2026-08-15",
    "upstream_schema_version": 1
  },
  "attributes": {
    "usb_ids": [
      {
        "vid": 8711,
        "pid": 13068,
        "architecture": "Rockchip RK3328 quad-core ARM Cortex-A53 @ 1.5 GHz (AArch64)"
      }
    ],
    "capabilities": [
      "gpio",
      "i2c",
      "pwm",
      "spi"
    ],
    "connectors": [
      "bare"
    ],
    "vendor": "FriendlyELEC",
    "ecosystem": "NanoPi",
    "transport": "native"
  },
  "links": {}
}
