{
  "schema_version": 0,
  "id": "electronic/sgp40",
  "namespace": "electronic",
  "name": "sgp40",
  "description": "Sensirion SGP40 — VOC air-quality gas sensor",
  "source": {
    "citation": "Oh-Ben-Claw registry/registry.json (generated from src/peripherals/registry.rs)",
    "retrieved": "2026-08-15",
    "upstream_schema_version": 1
  },
  "attributes": {
    "bus": "i2c",
    "default_i2c_addr": 89,
    "capabilities": [
      "sensor_read"
    ],
    "compatible_boards": [],
    "connector": "qwiic"
  },
  "links": {}
}
