{
  "schema_version": 0,
  "id": "electronic/sht31",
  "namespace": "electronic",
  "name": "sht31",
  "description": "Sensirion SHT31 — high-accuracy temperature and humidity",
  "source": {
    "citation": "Oh-Ben-Claw registry/registry.json (generated from src/peripherals/registry.rs)",
    "retrieved": "2026-08-15",
    "upstream_schema_version": 1
  },
  "attributes": {
    "bus": "i2c",
    "default_i2c_addr": 68,
    "capabilities": [
      "sensor_read"
    ],
    "compatible_boards": [],
    "connector": "bare"
  },
  "links": {}
}
