{
  "schema_version": 0,
  "id": "electronic/sg90",
  "namespace": "electronic",
  "name": "sg90",
  "description": "TowerPro SG90 — micro servo (PWM position control)",
  "source": {
    "citation": "Oh-Ben-Claw registry/registry.json (generated from src/peripherals/registry.rs)",
    "retrieved": "2026-08-15",
    "upstream_schema_version": 1
  },
  "attributes": {
    "bus": "pwm",
    "default_i2c_addr": null,
    "capabilities": [
      "actuate"
    ],
    "compatible_boards": [],
    "connector": "bare"
  },
  "links": {}
}
