{
  "schema_version": 0,
  "id": "electronic/rpi-ai-hat-plus-2",
  "namespace": "electronic",
  "name": "rpi-ai-hat-plus-2",
  "description": "Raspberry Pi AI HAT+ 2 — Hailo-10H NPU, 40 TOPS INT4 / 20 TOPS INT8, GenAI-capable (RPi 5, PCIe)",
  "source": {
    "citation": "Oh-Ben-Claw registry/registry.json (generated from src/peripherals/registry.rs)",
    "retrieved": "2026-08-15",
    "upstream_schema_version": 1
  },
  "attributes": {
    "bus": "pcie",
    "default_i2c_addr": null,
    "capabilities": [
      "hailo"
    ],
    "compatible_boards": [
      "raspberry-pi-5"
    ],
    "connector": "hat_pi"
  },
  "links": {}
}
