{
  "schema_version": 0,
  "id": "boards/dfrobot-firebeetle2-esp32s3",
  "namespace": "boards",
  "name": "dfrobot-firebeetle2-esp32s3",
  "description": "ESP32-S3 LX7 dual-core @ 240 MHz, LiPo charge, onboard GDI (native USB; shared VID/PID)",
  "source": {
    "citation": "Oh-Ben-Claw registry/registry.json (generated from src/peripherals/registry.rs)",
    "retrieved": "2026-08-15",
    "upstream_schema_version": 1
  },
  "attributes": {
    "usb_ids": [
      {
        "vid": 12346,
        "pid": 4097,
        "architecture": "ESP32-S3 LX7 dual-core @ 240 MHz, LiPo charge, onboard GDI (native USB; shared VID/PID)"
      }
    ],
    "capabilities": [
      "analog_read",
      "battery",
      "ble",
      "gpio",
      "i2c",
      "spi",
      "wifi"
    ],
    "connectors": [
      "bare"
    ],
    "vendor": "DFRobot",
    "ecosystem": "FireBeetle",
    "transport": "serial"
  },
  "envelope_mm": {
    "x": 25.5,
    "y": 61.47,
    "z": 8.45,
    "source": {
      "citation": "Axis-aligned bounding box of DFRobot's vendor STEP model DFR0975.stp (sha256 6c2fa63dd92cb8555d65828c2c9446dc758f0537b32f36a6e4fcfdf2bef0a3c9, inside '3D Model/' of DFR0975_firebeetle-esp32-s3-ai-acceleration-board_stpfile_1.zip, sha256 0e7feac458213620edf605c85120bf314f17df51fc79858c8800450c019b6d4e), computed 2026-09-06 with OCCT 7.9.3 (cadquery-ocp 7.9.3.1.1) BRepBndLib::AddOptimal after 0.05 mm incremental meshing: 25.5000 x 61.4706 x 8.4477 mm, rounded up to 0.01. Z spans PCB underside (z=0) to the tallest top-side component; the model carries no headers. PCB outline is 25.4 x 60.0 mm, thickness 1.6 mm, per 'DFR0975 dimension V1.3.pdf' (dimension_V1.3.zip, drawing dated 2026-06-17); the STEP file's own timestamp is 2023-10-20 and it does not state which board revision it depicts.",
      "url": "https://wiki.dfrobot.com/dfr0975",
      "retrieved": "2026-09-06"
    }
  },
  "links": {
    "model_3d": "sha256:6c2fa63dd92cb8555d65828c2c9446dc758f0537b32f36a6e4fcfdf2bef0a3c9"
  }
}
