{
  "schema_version": 0,
  "id": "boards/nucleo-l476rg",
  "namespace": "boards",
  "name": "nucleo-l476rg",
  "description": "ARM Cortex-M4 @ 80 MHz (STM32L476RG, ultra-low-power)",
  "source": {
    "citation": "Oh-Ben-Claw registry/registry.json (generated from src/peripherals/registry.rs)",
    "retrieved": "2026-08-15",
    "upstream_schema_version": 1
  },
  "attributes": {
    "usb_ids": [
      {
        "vid": 1155,
        "pid": 14159,
        "architecture": "ARM Cortex-M4 @ 80 MHz (STM32L476RG, ultra-low-power)"
      }
    ],
    "capabilities": [
      "analog_read",
      "analog_write",
      "flash",
      "gpio",
      "i2c",
      "pwm",
      "rtt",
      "spi"
    ],
    "connectors": [
      "bare"
    ],
    "vendor": "STMicroelectronics",
    "ecosystem": "Nucleo-64",
    "transport": "probe"
  },
  "links": {}
}
